{
  "acceptance": {
    "connection_readability": false,
    "player_camera_readability": false,
    "silhouette_unique": false
  },
  "animated_variants": [
    "A"
  ],
  "asset_id": "P2D_QS_GRASS_TUFT_A",
  "atlas_cell_count": 6,
  "atlas_group": "QS_Plant_A_Wind",
  "batch": "B2",
  "card_world_size_m": [
    0.8,
    0.8
  ],
  "category": "paper2d_plant",
  "cluster_size": 7,
  "collision": false,
  "cull_distance_m": 35.0,
  "dependencies": [
    "REF_QS_ENV_STYLE_LOCK",
    "REF_QS_SCALE_LINEUP"
  ],
  "depth_layer": "midground_foliage",
  "detail_budget": {
    "forbidden_micro_detail": [
      "individual_roof_tiles",
      "repeated_window_lattices",
      "leaf_by_leaf_foliage",
      "stone_or_pebble_tessellation",
      "tiny_prop_piles"
    ],
    "main_value_bands": 2,
    "max_primary_masses": 3,
    "max_secondary_internal_stroke_groups": 5,
    "object_rule": "plant uses two or three broad crown groups plus one main trunk",
    "prompt_instruction": "Every object must read at 128px; use at most 3 primary masses and 5 secondary internal accent strokes or stroke groups; use 2 main value bands plus 1 shadow accent; forbid individual_roof_tiles, repeated_window_lattices, leaf_by_leaf_foliage, stone_or_pebble_tessellation, tiny_prop_piles; plant uses two or three broad crown groups plus one main trunk.",
    "shadow_accent_bands": 1,
    "thumbnail_readability_px": 128
  },
  "display_name": "青山镇草簇族 A",
  "facing_mode": "fixed_camera_card",
  "forward_axis": "+Y",
  "gameplay_role": "grass",
  "generation": {
    "asset_type": "Qingshan paper2d_plant game environment reference",
    "avoid": [
      "photorealistic",
      "modern object",
      "readable text",
      "logo",
      "watermark",
      "neon green",
      "mirror symmetry",
      "cropped subject",
      "PBR plastic shine"
    ],
    "blocked_after_revisions": 2,
    "composition_framing": "complete uncropped asset with readable base, scale and connection points for the fixed high three-quarter game camera",
    "constraints": [
      "photorealistic",
      "modern object",
      "readable text",
      "logo",
      "watermark",
      "neon green",
      "mirror symmetry",
      "cropped subject",
      "PBR plastic shine"
    ],
    "generation_calls_used": 0,
    "input_image_roles": [
      {
        "path": "style/references/style_env_day.jpeg",
        "role": "environment_style"
      },
      {
        "path": "style/references/style_env_night.jpeg",
        "role": "environment_atmosphere"
      },
      {
        "path": "style/references/style_nature_group.jpeg",
        "role": "shape_language"
      },
      {
        "path": "style/boards/REF_QS_ENV_STYLE_LOCK__board__v003.png",
        "role": "generated_style_lock"
      },
      {
        "path": "style/boards/REF_QS_SCALE_LINEUP__board__v001.png",
        "role": "generated_scale_lineup"
      }
    ],
    "input_images": [
      "style/references/style_env_day.jpeg",
      "style/references/style_env_night.jpeg",
      "style/references/style_nature_group.jpeg",
      "style/boards/REF_QS_ENV_STYLE_LOCK__board__v003.png",
      "style/boards/REF_QS_SCALE_LINEUP__board__v001.png"
    ],
    "lighting_mood": "neutral soft daylight with calm mist-compatible contrast",
    "max_generation_calls": 9,
    "max_versions_per_view": 3,
    "palette": [
      "warm_off_white",
      "dark_teal_ink",
      "jade_green",
      "blue_gray",
      "warm_ochre",
      "muted_jade"
    ],
    "prompt": "Use case: stylized-concept\nAsset type: Qingshan paper2d_plant game environment reference\nPrimary request: Three low grass tufts; only A receives four wind poses\nInput images: project references define ink-cartoon brushwork, scale, shape language and restrained palette; do not copy their subjects\nScene/backdrop: clean warm rice-paper background suitable for a single asset or the approved compact kit\nSubject: Three low grass tufts; only A receives four wind poses; intended gameplay role is grass\nStyle/medium: QS_InkToon_v1 hand-drawn Chinese ink cartoon, dry-brush broken edges, simplified chunky silhouettes, two to three value bands\nComposition/framing: complete uncropped asset with readable base, scale and connection points for the fixed high three-quarter game camera\nLighting/mood: neutral soft daylight with calm mist-compatible contrast\nConstraints: no text, no logos, no watermark, no photorealism, no PBR shine, no neon green, no modern objects, no mirror symmetry\nView neutral_variants: Show the A, B and C plant silhouettes separately before any animation; required elements: separate_A_B_C, stable_root_or_trunk, warm_plain_background\nView silhouette_scale_cluster: Show black silhouettes with the project scale ruler and a 3–5 plant cluster; required elements: black_silhouette, project_character_and_building_scale_ruler, cluster_of_3_to_5\nView wind_poses: Derive the ordered wind poses only from approved neutral variant A; required elements: only_variant_A_animated, B_and_C_static, explicit_frame_sequence, stable_root_or_trunk\nDetail budget: Every object must read at 128px; use at most 3 primary masses and 5 secondary internal accent strokes or stroke groups; use 2 main value bands plus 1 shadow accent; forbid individual_roof_tiles, repeated_window_lattices, leaf_by_leaf_foliage, stone_or_pebble_tessellation, tiny_prop_piles; plant uses two or three broad crown groups plus one main trunk.",
    "prompt_sections": {
      "asset_type": "Qingshan paper2d_plant game environment reference",
      "composition_framing": "complete uncropped asset with readable base, scale and connection points for the fixed high three-quarter game camera",
      "constraints": "no text, no logos, no watermark, no photorealism, no PBR shine, no neon green, no modern objects, no mirror symmetry",
      "detail_budget": "Every object must read at 128px; use at most 3 primary masses and 5 secondary internal accent strokes or stroke groups; use 2 main value bands plus 1 shadow accent; forbid individual_roof_tiles, repeated_window_lattices, leaf_by_leaf_foliage, stone_or_pebble_tessellation, tiny_prop_piles; plant uses two or three broad crown groups plus one main trunk.",
      "input_images": "project references define ink-cartoon brushwork, scale, shape language and restrained palette; do not copy their subjects",
      "lighting_mood": "neutral soft daylight with calm mist-compatible contrast",
      "primary_request": "Three low grass tufts; only A receives four wind poses",
      "scene_backdrop": "clean warm rice-paper background suitable for a single asset or the approved compact kit",
      "style_medium": "QS_InkToon_v1 hand-drawn Chinese ink cartoon, dry-brush broken edges, simplified chunky silhouettes, two to three value bands",
      "subject": "Three low grass tufts; only A receives four wind poses; intended gameplay role is grass",
      "use_case": "stylized-concept",
      "view_contracts": {
        "neutral_variants": {
          "instruction": "Show the A, B and C plant silhouettes separately before any animation",
          "required_elements": [
            "separate_A_B_C",
            "stable_root_or_trunk",
            "warm_plain_background"
          ]
        },
        "silhouette_scale_cluster": {
          "instruction": "Show black silhouettes with the project scale ruler and a 3–5 plant cluster",
          "required_elements": [
            "black_silhouette",
            "project_character_and_building_scale_ruler",
            "cluster_of_3_to_5"
          ]
        },
        "wind_poses": {
          "frame_sequence": [
            "neutral",
            "left",
            "right",
            "slight_return"
          ],
          "instruction": "Derive the ordered wind poses only from approved neutral variant A",
          "required_elements": [
            "only_variant_A_animated",
            "B_and_C_static",
            "explicit_frame_sequence",
            "stable_root_or_trunk"
          ]
        }
      },
      "view_neutral_variants": "Show the A, B and C plant silhouettes separately before any animation; required elements: separate_A_B_C, stable_root_or_trunk, warm_plain_background",
      "view_silhouette_scale_cluster": "Show black silhouettes with the project scale ruler and a 3–5 plant cluster; required elements: black_silhouette, project_character_and_building_scale_ruler, cluster_of_3_to_5",
      "view_wind_poses": "Derive the ordered wind poses only from approved neutral variant A; required elements: only_variant_A_animated, B_and_C_static, explicit_frame_sequence, stable_root_or_trunk"
    },
    "required_view_kinds": [
      "neutral_variants",
      "silhouette_scale_cluster",
      "wind_poses"
    ],
    "scene_backdrop": "clean warm rice-paper background suitable for a single asset or the approved compact kit",
    "style_medium": "QS_InkToon_v1 hand-drawn Chinese ink cartoon, dry-brush broken edges, simplified chunky silhouettes, two to three value bands",
    "subject": "Three low grass tufts; only A receives four wind poses; intended gameplay role is grass",
    "use_case": "stylized-concept"
  },
  "ground_trace_required": true,
  "intended_zone": [
    "ground"
  ],
  "masked_material": true,
  "material_language": [
    "QS_InkToon_v1",
    "two_to_three_value_bands",
    "dry_brush_edges"
  ],
  "negative_prompt": [
    "photorealistic",
    "modern object",
    "readable text",
    "logo",
    "watermark",
    "neon green",
    "mirror symmetry",
    "cropped subject",
    "PBR plastic shine"
  ],
  "palette": [
    "warm_off_white",
    "dark_teal_ink",
    "jade_green",
    "blue_gray",
    "warm_ochre",
    "muted_jade"
  ],
  "paper2d": {
    "animation_rule": "only_A_animated_B_and_C_static",
    "atlas_cell_count": 6,
    "background_policy": "concept_warm_plain_production_magenta_key",
    "content_box_px": [
      192,
      192
    ],
    "expected_world_size_m": [
      0.8,
      0.8
    ],